{
  "schema_version": "2.2.0",
  "generated_at": "2026-07-15T19:00:00Z",
  "freshness": {
    "live_feed_age_seconds": 6.0,
    "silver_lag_seconds": 212.0,
    "gold_age_seconds": 63000.0
  },
  "sources": [
    {
      "source": "glm-east",
      "series_start": "2026-07-15T18:00:00Z",
      "flashes_per_minute": [
        877,
        1231,
        1677,
        1265,
        1246,
        807,
        1142,
        1172,
        1197,
        1595,
        1171,
        769,
        1559,
        1205,
        822,
        1240,
        1691,
        899,
        1242,
        1655,
        897,
        1278,
        1779,
        990,
        1432,
        1440,
        1470,
        1467,
        1964,
        1061,
        1521,
        1522,
        2135,
        1082,
        1523,
        1637,
        1536,
        1587,
        1563,
        2112,
        1017,
        1526,
        1592,
        2104,
        1081,
        2049,
        1604,
        1055,
        2028,
        1545,
        1061,
        2030,
        1532,
        1020,
        1608,
        2061,
        1572,
        1054,
        2116,
        1042
      ],
      "latency_p50_seconds": 47.6,
      "latency_p95_seconds": 68.4,
      "completeness": 1.0,
      "last_file_time": "2026-07-15T18:59:40Z",
      "error_budget_remaining": 0.94
    },
    {
      "source": "glm-west",
      "series_start": "2026-07-15T18:00:00Z",
      "flashes_per_minute": [
        23,
        11,
        17,
        12,
        11,
        14,
        14,
        10,
        6,
        14,
        6,
        7,
        8,
        10,
        6,
        10,
        7,
        5,
        15,
        3,
        1,
        2,
        7,
        11,
        27,
        16,
        40,
        39,
        37,
        50,
        52,
        87,
        44,
        96,
        103,
        132,
        121,
        211,
        148,
        110,
        167,
        270,
        102,
        184,
        227,
        227,
        233,
        297,
        130,
        213,
        235,
        230,
        244,
        294,
        171,
        318,
        0,
        0,
        0,
        0
      ],
      "latency_p50_seconds": 49.2,
      "latency_p95_seconds": 68.6,
      "completeness": 0.933,
      "last_file_time": "2026-07-15T18:55:40Z",
      "error_budget_remaining": 0.61
    },
    {
      "source": "mtg-li",
      "series_start": "2026-07-15T18:00:00Z",
      "flashes_per_minute": [
        528,
        1563,
        1090,
        1065,
        473,
        1566,
        511,
        1545,
        1029,
        523,
        1530,
        558,
        1571,
        1141,
        1097,
        1150,
        1077,
        1148,
        558,
        1626,
        1111,
        1101,
        1117,
        1086,
        1074,
        1143,
        558,
        1627,
        1120,
        1150,
        1115,
        1150,
        512,
        1132,
        1721,
        1137,
        592,
        1724,
        1170,
        1192,
        1168,
        1200,
        1239,
        609,
        1259,
        1252,
        1898,
        615,
        1920,
        1238,
        1266,
        1277,
        1326,
        667,
        1919,
        674,
        1963,
        1331,
        637,
        1295
      ],
      "latency_p50_seconds": 49.0,
      "latency_p95_seconds": 83.1,
      "completeness": 1.0,
      "last_file_time": "2026-07-15T18:59:30Z",
      "error_budget_remaining": 0.88
    }
  ],
  "quality": {
    "status": "warn",
    "checked_at": "2026-07-15T18:55:00Z",
    "failed": [
      "silver_volume"
    ]
  },
  "catalog": {
    "month": "2026-07",
    "operations": 21480,
    "free_tier": 1000000
  }
}
